{
  "version": 1,
  "direction": "AUTO",
  "layoutGoal": "fit-page",
  "page": {"width":3000,"height":1500,"margin":24,"minBodyFontSize":9,"orientation":"landscape","minStrokeWidth":0.5},
  "theme": {"visual":true,"crossingBridges":true,"colorMode":"proximity","groupEdgesByAction":true,"labelWidth":104},
  "nodes": [
    {"id":"request","title":"Experiment request","kind":"screen","rows":[{"role":"input","required":true,"label":"Research question"},{"role":"cta","text":"Open study"}]},
    {"id":"scope","title":"Scope review","kind":"dialog","rows":[{"role":"shown","text":"Check novelty and resources"},{"role":"condition","predicate":"Scope is feasible","then":"Approve plan","thenRole":"cta"}]},
    {"id":"protocol","title":"Protocol studio","kind":"screen","rows":[{"role":"shown","text":"Specify controls and sampling"},{"role":"rule","text":"Every revision keeps an audit trail"}]},
    {"id":"registry","title":"Protocol registry","kind":"boundary","rows":[{"role":"shown","text":"Immutable protocol revision"}]},
    {"id":"sensor","title":"Sensor array","kind":"external","rows":[{"role":"shown","text":"Fictional coastal observatory"}]},
    {"id":"capture","title":"Capture gateway","kind":"screen","rows":[{"role":"shown","text":"Batch and timestamp readings"}]},
    {"id":"raw","title":"Raw archive","kind":"boundary","rows":[{"role":"shown","text":"Encrypted observation objects"}]},
    {"id":"clean","title":"Cleaning pipeline","kind":"screen","rows":[{"role":"condition","predicate":"Quality flags pass","then":"Normalize stream","thenRole":"cta"},{"role":"warning","text":"Quarantine anomalous batches"}]},
    {"id":"catalog","title":"Feature catalog","kind":"screen","rows":[{"role":"shown","text":"Traceable derived variables"}]},
    {"id":"simulator","title":"Scenario simulator","kind":"dialog","rows":[{"role":"shown","text":"Generate synthetic controls"},{"role":"cta","text":"Run scenario"}]},
    {"id":"model","title":"Model workshop","kind":"screen","rows":[{"role":"shown","text":"Fit constrained response families"},{"role":"rule","text":"Compare against held-out controls"}]},
    {"id":"validation","title":"Validation bench","kind":"dialog","rows":[{"role":"input","required":true,"label":"Acceptance threshold"},{"role":"cta","text":"Validate candidate"}]},
    {"id":"review","title":"Evidence review","kind":"screen","rows":[{"role":"shown","text":"Inspect diagnostics and uncertainty"}]},
    {"id":"revision","title":"Revision queue","kind":"screen","rows":[{"role":"note","text":"Route feedback to the owning stage"}]},
    {"id":"figures","title":"Figure assembly","kind":"screen","rows":[{"role":"shown","text":"Generate annotated panels"}]},
    {"id":"appendix","title":"Appendix bundle","kind":"boundary","rows":[{"role":"shown","text":"Methods and provenance tables"}]},
    {"id":"paper","title":"Paper package","kind":"boundary","rows":[{"role":"shown","text":"Synthetic study report"}]},
    {"id":"public-ref","title":"Data portal","kind":"screen","presentation":"reference","canonicalNodeId":"public-data-portal","showcasePage":2},
    {"id":"archive-ref","title":"Archive details","kind":"screen","presentation":"reference","canonicalNodeId":"raw-archive-specification","showcasePage":3}
  ],
  "edges": [
    {"id":"open","source":"request","target":"scope","label":"submit research question","labelParts":{"action":"Submit","predicates":["new study"]}},
    {"id":"approve","source":"scope","target":"protocol","label":"approve experimental scope","labelParts":{"action":"Approve","predicates":["feasible"]}},
    {"id":"register","source":"protocol","target":"registry","label":"register immutable protocol revision","semanticClass":"secondary"},
    {"id":"deploy","source":"protocol","target":"sensor","label":"deploy sampling configuration"},
    {"id":"stream","source":"sensor","target":"capture","label":"stream calibrated observations"},
    {"id":"store","source":"capture","target":"raw","label":"store raw observation objects","semanticClass":"secondary"},
    {"id":"clean-input","source":"capture","target":"clean","label":"route timestamped observation batch"},
    {"id":"baseline","source":"registry","target":"clean","label":"retrieve protocol baseline","style":"dashed","semanticClass":"optional"},
    {"id":"derive","source":"clean","target":"catalog","label":"derive quality-controlled features"},
    {"id":"simulate","source":"catalog","target":"simulator","label":"seed synthetic control scenarios"},
    {"id":"fit","source":"catalog","target":"model","label":"provide descriptor matrix for constrained fitting"},
    {"id":"controls","source":"simulator","target":"model","label":"supply counterfactual control ensemble","semanticClass":"secondary"},
    {"id":"validate","source":"model","target":"validation","label":"submit candidate model and uncertainty envelope"},
    {"id":"inspect","source":"validation","target":"review","label":"review validation diagnostics"},
    {"id":"revise-model","source":"review","target":"revision","label":"request model revision","style":"dashed","semanticClass":"optional"},
    {"id":"revise-protocol","source":"revision","target":"protocol","label":"return protocol clarification","style":"dashed","semanticClass":"optional"},
    {"id":"refit","source":"revision","target":"model","label":"return model calibration note","style":"dashed","semanticClass":"optional"},
    {"id":"compose","source":"review","target":"figures","label":"compose evidence figure panels"},
    {"id":"append","source":"figures","target":"appendix","label":"attach provenance appendix"},
    {"id":"publish","source":"figures","target":"paper","label":"assemble publication-ready results"},
    {"id":"methods","source":"appendix","target":"paper","label":"include reproducible methods record","semanticClass":"secondary"},
    {"id":"portal","source":"paper","target":"public-ref","label":"publish synthetic dataset metadata"},
    {"id":"archive-link","source":"raw","target":"archive-ref","label":"link retained raw archive metadata","semanticClass":"secondary"},
    {"id":"feedback-data","source":"review","target":"clean","label":"send anomaly feedback to cleaning pipeline","style":"dashed","semanticClass":"alert"},
    {"id":"feedback-capture","source":"clean","target":"capture","label":"request recapture for flagged measurements","style":"dashed","semanticClass":"alert"},
    {"id":"cross-a","source":"scope","target":"validation","label":"carry approved acceptance criteria","semanticClass":"secondary"},
    {"id":"cross-b","source":"raw","target":"review","label":"compare archive completeness during review","semanticClass":"secondary"},
    {"id":"cross-c","source":"registry","target":"appendix","label":"cite registered protocol identifier","semanticClass":"secondary"},
    {"id":"cross-d","source":"simulator","target":"figures","label":"annotate simulated control envelope","semanticClass":"secondary"},
    {"id":"cross-e","source":"catalog","target":"appendix","label":"summarize feature lineage","semanticClass":"secondary"},
    {"id":"cross-f","source":"sensor","target":"public-ref","label":"describe instrument channel availability","semanticClass":"secondary"},
    {"id":"cross-g","source":"request","target":"revision","label":"preserve original question when revisions occur","semanticClass":"secondary"},
    {"id":"cross-h","source":"validation","target":"paper","label":"record acceptance decision","semanticClass":"secondary"},
    {"id":"cross-i","source":"raw","target":"model","label":"audit raw sample traceability","style":"dashed","semanticClass":"optional"},
    {"id":"cross-j","source":"protocol","target":"appendix","label":"supply parameter definitions","semanticClass":"secondary"},
    {"id":"cross-k","source":"clean","target":"figures","label":"report exclusion counts","semanticClass":"secondary"}
  ],
  "continuations": [
    {"incomingEdge":"approve","outgoingEdge":"register","throughNode":"protocol"},
    {"incomingEdge":"revise-protocol","outgoingEdge":"register","throughNode":"protocol"}
  ]
}
